[{"id":5,"dateAddedLocal":"04/09/2017, 10:39:51","dateAddedUTC":"2017-09-04T05:09:51.899Z","index":0,"parentId":"1","title":"greytHR Login","url":"https://gaiansolutions.greythr.com/login.do"},{"id":6,"dateAddedLocal":"11/07/2018, 12:31:28","dateAddedUTC":"2018-07-11T07:01:28.346Z","index":1,"parentId":"1","title":"Google Docs"},{"id":118,"dateAddedLocal":"15/09/2017, 13:08:03","dateAddedUTC":"2017-09-15T07:38:03.000Z","index":0,"parentId":"6","title":"Snap Pack Deployments from Dev - Google Sheets","url":"https://docs.google.com/spreadsheets/d/1DFtdQewu7Ed6DPEvwU8Tq9saL_WcklKhvuuihd_lnfo/edit#gid=636262743"},{"id":119,"dateAddedLocal":"15/09/2017, 13:08:51","dateAddedUTC":"2017-09-15T07:38:51.000Z","index":1,"parentId":"6","title":"Doc Mapping File for Moving Docs to Confluence - Google Sheets","url":"https://docs.google.com/spreadsheets/d/1Y8gdImDiQivMsuQTqJ1s9nK5uezZ2awnAe-uIjD6VZM/edit?ts=58f52d6e#gid=456110201"},{"id":120,"dateAddedLocal":"15/09/2017, 13:10:38","dateAddedUTC":"2017-09-15T07:40:38.000Z","index":2,"parentId":"6","title":"Doc Update for Snaps - Google Sheets","url":"https://docs.google.com/spreadsheets/d/1PXRTQhy9LFQpes5pN5t12PF8h4ctTH_IAx1ZUGSKLoY/edit#gid=1780286459"},{"id":121,"dateAddedLocal":"15/09/2017, 13:11:04","dateAddedUTC":"2017-09-15T07:41:04.000Z","index":3,"parentId":"6","title":"Snap Support - Google Sheets","url":"https://docs.google.com/spreadsheets/d/13URA5_rpNFbaRGNe0EU4q5l65un6Zbag_WzZshg3CaE/edit?ts=573c8a15#gid=259853089"},{"id":122,"dateAddedLocal":"25/10/2017, 11:57:14","dateAddedUTC":"2017-10-25T06:27:14.985Z","index":4,"parentId":"6","title":"Release Notes and UAT Push Candidates - Google Sheets","url":"https://docs.google.com/spreadsheets/d/1oGRmBIUCqQCPNitXII7iH56dF7Db54CBlDGgVrrOaKE/edit?ts=59ea4388#gid=925260519"},{"id":123,"dateAddedLocal":"25/10/2017, 11:57:27","dateAddedUTC":"2017-10-25T06:27:27.064Z","index":5,"parentId":"6","title":"Doc Mapping File for Moving Docs to Confluence - Google Sheets","url":"https://docs.google.com/spreadsheets/d/1Y8gdImDiQivMsuQTqJ1s9nK5uezZ2awnAe-uIjD6VZM/edit?ts=58f52d6e#gid=701716574"},{"id":124,"dateAddedLocal":"11/04/2018, 10:27:41","dateAddedUTC":"2018-04-11T04:57:41.057Z","index":6,"parentId":"6","title":"Diagnostic Accounts - Google Sheets","url":"https://docs.google.com/spreadsheets/d/16xt9Y3A09iff7BvG7NwDL8G0p5aQYWtR66kFN7I8qVI/edit#gid=0"},{"id":125,"dateAddedLocal":"02/07/2018, 21:47:12","dateAddedUTC":"2018-07-02T16:17:12.184Z","index":7,"parentId":"6","title":"SnapLogic Manager Help Requirements Identification Sheet - Google Sheets","url":"https://docs.google.com/spreadsheets/d/1fxjOYwlTwzL9JNLL88KiakWwMUdGONpjT-PlMOM4DsA/edit?ts=5b39a5f4#gid=853684107"},{"id":127,"dateAddedLocal":"12/07/2018, 18:08:47","dateAddedUTC":"2018-07-12T12:38:47.430Z","index":8,"parentId":"6","title":"Daily Status Update Tracker - Google Sheets","url":"https://docs.google.com/spreadsheets/d/1odnQ1RiuQvu_fm3jKDh8LKfFibXKaxKS4CCchcAVIj0/edit#gid=0"},{"id":7,"dateAddedLocal":"15/09/2017, 12:18:01","dateAddedUTC":"2017-09-15T06:48:01.000Z","index":2,"parentId":"1","title":"  Jira Tickets  ","url":"https://mysnaplogic.atlassian.net/issues/?filter=21644&jql=assignee%20in%20(currentUser())%20ORDER%20BY%20status%20ASC"},{"id":8,"dateAddedLocal":"11/07/2018, 12:31:28","dateAddedUTC":"2018-07-11T07:01:28.347Z","index":3,"parentId":"1","title":"Reltio"},{"id":116,"dateAddedLocal":"12/06/2018, 16:18:43","dateAddedUTC":"2018-06-12T10:48:43.483Z","index":0,"parentId":"8","title":"- Reltio REST API Reference","url":"https://help.reltio.com/index.html#restapis/aboutrestapi.html"},{"id":117,"dateAddedLocal":"12/06/2018, 17:10:26","dateAddedUTC":"2018-06-12T11:40:26.832Z","index":1,"parentId":"8","title":"Reltio","url":"https://sndbx.reltio.com/ui/XK178mXYr3UZrG6/#p~com.reltio.plugins.interactions.InteractionsPerspective_w~z8i_e~entities%2FZtGk5s0"},{"id":9,"dateAddedLocal":"11/07/2018, 12:31:28","dateAddedUTC":"2018-07-11T07:01:28.347Z","index":4,"parentId":"1","title":"Pods"},{"id":109,"dateAddedLocal":"06/11/2017, 14:09:39","dateAddedUTC":"2017-11-06T08:39:39.060Z","index":0,"parentId":"9","title":"Pigeon Pod","url":"https://pigeon.elastic.snaplogic.com/sl/login.html?"},{"id":110,"dateAddedLocal":"18/09/2017, 11:15:23","dateAddedUTC":"2017-09-18T05:45:23.000Z","index":1,"parentId":"9","title":"Snappod","url":"https://snap.elastic.snaplogic.com/sl/designer.html?v=c439"},{"id":111,"dateAddedLocal":"09/08/2017, 11:22:32","dateAddedUTC":"2017-08-09T05:52:32.489Z","index":2,"parentId":"9","title":"Elastic","url":"https://elastic.snaplogic.com/sl/designer.html?v=mrcb80"},{"id":112,"dateAddedLocal":"27/04/2018, 18:20:33","dateAddedUTC":"2018-04-27T12:50:33.415Z","index":3,"parentId":"9","title":"Canary","url":"https://canary.elastic.snaplogic.com/sl/designer.html?v=4066"},{"id":113,"dateAddedLocal":"27/04/2018, 18:20:47","dateAddedUTC":"2018-04-27T12:50:47.489Z","index":4,"parentId":"9","title":"UAT","url":"https://uat.elastic.snaplogic.com/sl/designer.html?v=4049#pipe_snode=5ae2bcf215071c0192a458d2"},{"id":114,"dateAddedLocal":"25/06/2018, 10:44:18","dateAddedUTC":"2018-06-25T05:14:18.930Z","index":5,"parentId":"9","title":"UX Pod","url":"https://ux2.clouddev.snaplogic.com/sl/designer.html?v=4200"},{"id":115,"dateAddedLocal":"05/07/2018, 12:57:05","dateAddedUTC":"2018-07-05T07:27:05.762Z","index":6,"parentId":"9","title":"Staging","url":"https://stage.elastic.snaplogic.com/sl/designer.html"},{"id":10,"dateAddedLocal":"11/07/2018, 12:31:28","dateAddedUTC":"2018-07-11T07:01:28.348Z","index":5,"parentId":"1","title":"CI/CD"},{"id":106,"dateAddedLocal":"08/06/2018, 15:45:33","dateAddedUTC":"2018-06-08T10:15:33.113Z","index":0,"parentId":"10","title":"CICD Content Outline - Google Drive","url":"https://drive.google.com/drive/u/1/folders/1IFStNBqAGXiizJyzq3KT5WTK6rv66MyG"},{"id":107,"dateAddedLocal":"08/06/2018, 15:46:11","dateAddedUTC":"2018-06-08T10:16:11.255Z","index":1,"parentId":"10","title":"Final Videos - Google Drive","url":"https://drive.google.com/drive/u/1/folders/1ow593ZzXJljcpHMJRZyDviN_LhFsttDd"},{"id":130,"dateAddedLocal":"18/07/2018, 10:49:10","dateAddedUTC":"2018-07-18T05:19:10.086Z","index":2,"parentId":"10","title":"Understanding the GitHub Flow · GitHub Guides","url":"https://guides.github.com/introduction/flow/"},{"id":11,"dateAddedLocal":"14/09/2017, 12:10:15","dateAddedUTC":"2017-09-14T06:40:15.777Z","index":6,"parentId":"1","title":"Confluence","url":"https://mysnaplogic.atlassian.net/wiki/my/recent-work"},{"id":12,"dateAddedLocal":"18/09/2017, 11:03:35","dateAddedUTC":"2017-09-18T05:33:35.000Z","index":7,"parentId":"1","title":"Live Docs - Confluence","url":"https://docs-snaplogic.atlassian.net/wiki/spaces/SD/overview?mode=global"},{"id":13,"dateAddedLocal":"15/09/2017, 13:13:12","dateAddedUTC":"2017-09-15T07:43:12.000Z","index":8,"parentId":"1","title":"miqbal | Eng Slack","url":"https://fullsail.slack.com/messages/D74LUSQNB/"},{"id":14,"dateAddedLocal":"11/07/2018, 12:31:28","dateAddedUTC":"2018-07-11T07:01:28.350Z","index":9,"parentId":"1","title":"Platform Training"},{"id":103,"dateAddedLocal":"22/11/2017, 15:15:13","dateAddedUTC":"2017-11-22T09:45:13.948Z","index":0,"parentId":"14","title":"100 Best SnapLogic Videos | Meta-Guide.com","url":"http://meta-guide.com/videography/100-best-snaplogic-videos"},{"id":104,"dateAddedLocal":"27/11/2017, 10:56:26","dateAddedUTC":"2017-11-27T05:26:26.048Z","index":1,"parentId":"14","title":"","url":"https://www.google.com/url?q=https%3A%2F%2Fsnaplogic.app.box.com%2Fs%2Funcghkmvcjntzatjod0hvysbk3biaxwk&sa=D&sntz=1&usg=AFQjCNGs8BG5PZhyfGSo3gF37QP0V1s-NA"},{"id":105,"dateAddedLocal":"15/09/2017, 13:12:30","dateAddedUTC":"2017-09-15T07:42:30.000Z","index":2,"parentId":"14","title":"Platform Dev Training - Engineering","url":"https://sites.google.com/a/snaplogic.com/engineering/platform-dev-training?pli=1#TOC-Recording1"},{"id":15,"dateAddedLocal":"27/11/2017, 11:07:39","dateAddedUTC":"2017-11-27T05:37:39.024Z","index":10,"parentId":"1","title":"SL Branding","url":"https://snaplogic.app.box.com/s/uncghkmvcjntzatjod0hvysbk3biaxwk/folder/27878291580"},{"id":16,"dateAddedLocal":"11/07/2018, 12:31:28","dateAddedUTC":"2018-07-11T07:01:28.351Z","index":11,"parentId":"1","title":"Snap Pack Research Archive"},{"id":86,"dateAddedLocal":"11/07/2018, 12:31:28","dateAddedUTC":"2018-07-11T07:01:28.358Z","index":0,"parentId":"16","title":"MSDAX"},{"id":94,"dateAddedLocal":"18/10/2017, 13:34:24","dateAddedUTC":"2017-10-18T08:04:24.277Z","index":0,"parentId":"86","title":"Dynamics AX Create - Draft Product Docs - Confluence","url":"https://mysnaplogic.atlassian.net/wiki/spaces/SPD/pages/60532407/Dynamics+AX+Create"},{"id":95,"dateAddedLocal":"18/10/2017, 13:34:41","dateAddedUTC":"2017-10-18T08:04:41.606Z","index":1,"parentId":"86","title":"Dynamics AX Read - Draft Product Docs - Confluence","url":"https://mysnaplogic.atlassian.net/wiki/spaces/SPD/pages/60532413/Dynamics+AX+Read"},{"id":96,"dateAddedLocal":"18/10/2017, 13:34:46","dateAddedUTC":"2017-10-18T08:04:46.998Z","index":2,"parentId":"86","title":"Dynamics AX Update - Draft Product Docs - Confluence","url":"https://mysnaplogic.atlassian.net/wiki/spaces/SPD/pages/60532416/Dynamics+AX+Update"},{"id":97,"dateAddedLocal":"18/10/2017, 14:00:33","dateAddedUTC":"2017-10-18T08:30:33.397Z","index":3,"parentId":"86","title":"Create","url":"https://mysnaplogic.atlassian.net/browse/SNAP-2655"},{"id":98,"dateAddedLocal":"18/10/2017, 14:00:51","dateAddedUTC":"2017-10-18T08:30:51.319Z","index":4,"parentId":"86","title":"Read","url":"https://mysnaplogic.atlassian.net/browse/SNAP-2658"},{"id":99,"dateAddedLocal":"18/10/2017, 14:00:59","dateAddedUTC":"2017-10-18T08:30:59.814Z","index":5,"parentId":"86","title":"Update","url":"https://mysnaplogic.atlassian.net/browse/SNAP-2661"},{"id":100,"dateAddedLocal":"18/10/2017, 14:29:00","dateAddedUTC":"2017-10-18T08:59:00.334Z","index":6,"parentId":"86","title":"Create New","url":"https://mysnaplogic.atlassian.net/wiki/spaces/SPD/pages/106693424/Microsoft+Dynamics+AX+Create"},{"id":101,"dateAddedLocal":"18/10/2017, 14:29:08","dateAddedUTC":"2017-10-18T08:59:08.917Z","index":7,"parentId":"86","title":"Read New","url":"https://mysnaplogic.atlassian.net/wiki/spaces/SPD/pages/104169591/Microsoft+Dynamics+AX+Read"},{"id":102,"dateAddedLocal":"18/10/2017, 14:29:13","dateAddedUTC":"2017-10-18T08:59:13.837Z","index":8,"parentId":"86","title":"Update New","url":"https://mysnaplogic.atlassian.net/wiki/spaces/SPD/pages/106791890/Microsoft+Dynamics+AX+Update"},{"id":87,"dateAddedLocal":"11/07/2018, 12:31:28","dateAddedUTC":"2018-07-11T07:01:28.358Z","index":1,"parentId":"16","title":"ServiceNow"},{"id":91,"dateAddedLocal":"17/10/2017, 15:47:28","dateAddedUTC":"2017-10-17T10:17:28.515Z","index":0,"parentId":"87","title":"Exporting data | ServiceNow Docs","url":"https://docs.servicenow.com/bundle/istanbul-servicenow-platform/page/administer/exporting-data/concept/c_ExportData.html"},{"id":92,"dateAddedLocal":"17/10/2017, 15:49:07","dateAddedUTC":"2017-10-17T10:19:07.112Z","index":1,"parentId":"87","title":"Encoded query strings | ServiceNow Docs","url":"https://docs.servicenow.com/bundle/istanbul-servicenow-platform/page/use/using-lists/concept/c_EncodedQueryStrings.html"},{"id":93,"dateAddedLocal":"17/10/2017, 15:56:42","dateAddedUTC":"2017-10-17T10:26:42.369Z","index":2,"parentId":"87","title":"Action parameters","url":"https://docs.servicenow.com/bundle/istanbul-servicenow-platform/page/integrate/inbound-other-web-services/concept/c_ActionParameters.html"},{"id":88,"dateAddedLocal":"11/07/2018, 12:31:28","dateAddedUTC":"2018-07-11T07:01:28.358Z","index":2,"parentId":"16","title":"MySQL-SNAP-3183"},{"id":89,"dateAddedLocal":"20/11/2017, 12:27:20","dateAddedUTC":"2017-11-20T06:57:20.463Z","index":0,"parentId":"88","title":"MySQL :: MySQL 5.7 Reference Manual :: 3.5 Using mysql in Batch Mode","url":"https://dev.mysql.com/doc/refman/5.7/en/batch-mode.html"},{"id":90,"dateAddedLocal":"20/11/2017, 14:42:40","dateAddedUTC":"2017-11-20T09:12:40.195Z","index":1,"parentId":"88","title":"MySQL :: MySQL Connector/J 5.1 Developer Guide :: 7 Connection Pooling with Connector/J","url":"https://dev.mysql.com/doc/connector-j/5.1/en/connector-j-usagenotes-j2ee-concepts-connection-pooling.html"},{"id":17,"dateAddedLocal":"11/07/2018, 12:31:28","dateAddedUTC":"2018-07-11T07:01:28.351Z","index":12,"parentId":"1","title":"Community"},{"id":82,"dateAddedLocal":"10/01/2018, 12:08:31","dateAddedUTC":"2018-01-10T06:38:31.961Z","index":0,"parentId":"17","title":"'$value' is undefined, was not found while evaluating the sub-expression - Designing Pipelines - SnapLogic Community","url":"https://community.snaplogic.com/t/value-is-undefined-was-not-found-while-evaluating-the-sub-expression/1942/4"},{"id":83,"dateAddedLocal":"10/01/2018, 12:08:59","dateAddedUTC":"2018-01-10T06:38:59.311Z","index":1,"parentId":"17","title":"Enhancement Request: Do not automatically enable tasks after saving - Enhancement Requests - SnapLogic Community","url":"https://community.snaplogic.com/t/enhancement-request-do-not-automatically-enable-tasks-after-saving/1073/5"},{"id":84,"dateAddedLocal":"10/01/2018, 12:09:02","dateAddedUTC":"2018-01-10T06:39:02.902Z","index":2,"parentId":"17","title":"Documentation Site Upgrade - Announcements - SnapLogic Community","url":"https://community.snaplogic.com/t/documentation-site-upgrade/450/2"},{"id":85,"dateAddedLocal":"10/01/2018, 12:09:06","dateAddedUTC":"2018-01-10T06:39:06.405Z","index":3,"parentId":"17","title":"Latest Designing Pipelines topics - SnapLogic Community","url":"https://community.snaplogic.com/c/pipelines"},{"id":18,"dateAddedLocal":"11/07/2018, 12:31:28","dateAddedUTC":"2018-07-11T07:01:28.351Z","index":13,"parentId":"1","title":"Archive"},{"id":51,"dateAddedLocal":"11/07/2018, 12:31:28","dateAddedUTC":"2018-07-11T07:01:28.355Z","index":0,"parentId":"18","title":"Reltio Snap Pack"},{"id":79,"dateAddedLocal":"11/12/2017, 12:41:13","dateAddedUTC":"2017-12-11T07:11:13.386Z","index":0,"parentId":"51","title":"[SNAP-2515] Spike for Reltio - JIRA","url":"https://mysnaplogic.atlassian.net/browse/SNAP-2515"},{"id":80,"dateAddedLocal":"21/12/2017, 16:17:18","dateAddedUTC":"2017-12-21T10:47:18.957Z","index":1,"parentId":"51","title":"TAS_Reltio_MDM_by_Mayank.mp4 - Google Drive","url":"https://drive.google.com/file/d/1uiiygHS_0olSQwRVoCmz_Ex4jwOvJzs4/view"},{"id":81,"dateAddedLocal":"22/12/2017, 15:19:51","dateAddedUTC":"2017-12-22T09:49:51.019Z","index":2,"parentId":"51","title":"2017-12-14 21.01 Reltio Snap Pack demo.mp4 - Google Drive","url":"https://drive.google.com/file/d/14Q1VIVBmhSt8QaXWm1lz-KRygsmjoWcd/view"},{"id":52,"dateAddedLocal":"11/07/2018, 12:31:28","dateAddedUTC":"2018-07-11T07:01:28.355Z","index":1,"parentId":"18","title":"SQS Snap Pack"},{"id":73,"dateAddedLocal":"22/12/2017, 11:58:28","dateAddedUTC":"2017-12-22T06:28:28.857Z","index":0,"parentId":"52","title":"General Recommendations - Amazon Simple Queue Service","url":"http://docs.aws.amazon.com/AWSSimpleQueueService/latest/SQSDeveloperGuide/general-recommendations.html"},{"id":74,"dateAddedLocal":"22/12/2017, 11:58:39","dateAddedUTC":"2017-12-22T06:28:39.135Z","index":1,"parentId":"52","title":"Amazon SQS Spike Document.docx - Google Docs","url":"https://docs.google.com/document/d/15200XxrEM9q7QSKuXeW6hbYkFAozNT3soEfDmgcXkcc/edit#heading=h.cs81prannylu"},{"id":75,"dateAddedLocal":"22/12/2017, 12:08:40","dateAddedUTC":"2017-12-22T06:38:40.439Z","index":2,"parentId":"52","title":"Recommendations for FIFO (First-In-First-Out) Queues - Amazon Simple Queue Service","url":"http://docs.aws.amazon.com/AWSSimpleQueueService/latest/SQSDeveloperGuide/FIFO-queue-recommendations.html"},{"id":76,"dateAddedLocal":"22/12/2017, 12:09:11","dateAddedUTC":"2017-12-22T06:39:11.055Z","index":3,"parentId":"52","title":"2017-12-21 20.30 Amazon SQS Snaps Demo for QA and Docs Team.mp4 - Google Drive","url":"https://drive.google.com/file/d/1PgwFUCdFoqL5o-sKme2BsGUFvjL8WNYA/view"},{"id":77,"dateAddedLocal":"22/12/2017, 12:09:15","dateAddedUTC":"2017-12-22T06:39:15.263Z","index":4,"parentId":"52","title":"Amazon SQS Home Page","url":"http://docs.aws.amazon.com/AWSSimpleQueueService/latest/SQSDeveloperGuide/Welcome.html"},{"id":78,"dateAddedLocal":"08/01/2018, 12:42:38","dateAddedUTC":"2018-01-08T07:12:38.193Z","index":5,"parentId":"52","title":"Amazon SQS notes - Google Docs","url":"https://docs.google.com/document/d/1YC-2rq1p3nwSzveJFsZjGUk0E12U2aSRk5JDvXlf71U/edit#"},{"id":53,"dateAddedLocal":"11/07/2018, 12:31:28","dateAddedUTC":"2018-07-11T07:01:28.355Z","index":2,"parentId":"18","title":"ACP"},{"id":69,"dateAddedLocal":"21/03/2018, 13:53:49","dateAddedUTC":"2018-03-21T08:23:49.403Z","index":0,"parentId":"53","title":"Course Catalog | Adobe Digital Learning Services","url":"https://training.adobe.com/training/courses.html"},{"id":70,"dateAddedLocal":"11/04/2018, 17:16:20","dateAddedUTC":"2018-04-11T11:46:20.189Z","index":1,"parentId":"53","title":"Authentication Overview","url":"https://www.adobe.io/apis/cloudplatform/console/authentication/gettingstarted.html"},{"id":71,"dateAddedLocal":"11/04/2018, 17:16:30","dateAddedUTC":"2018-04-11T11:46:30.981Z","index":2,"parentId":"53","title":"API Key Integration","url":"https://www.adobe.io/apis/cloudplatform/console/authentication/api_key_workflow.html"},{"id":72,"dateAddedLocal":"11/04/2018, 17:33:10","dateAddedUTC":"2018-04-11T12:03:10.670Z","index":3,"parentId":"53","title":"Sign in - Adobe ID","url":"https://adobeid-na1.services.adobe.com/renga-idprovider/pages/login?callback=https%3A%2F%2Fims-na1.adobelogin.com%2Fims%2Fadobeid%2Facp_ui_platform%2FAdobeID%2Fcode%3Fredirect_uri%3Dhttps%253A%252F%252Fui-prod1-va7.cloud.adobe.io%252Fims%252Fconsume%252FaHR0cDovL3VpLXByb2QxLXZhNy5jbG91ZC5hZG9iZS5pby8%253D&client_id=acp_ui_platform&scope=openid%2Csession%2Cread_organizations%2Cadditional_info.projectedProductContext%2CAdobeID&denied_callback=https%3A%2F%2Fims-na1.adobelogin.com%2Fims%2Fdenied%2Facp_ui_platform%3Fredirect_uri%3Dhttps%253A%252F%252Fui-prod1-va7.cloud.adobe.io%252Fims%252Fconsume%252FaHR0cDovL3VpLXByb2QxLXZhNy5jbG91ZC5hZG9iZS5pby8%253D%26response_type%3Dcode&display=web_v2&relay=7b817159-fa16-4be9-a4c7-bb0830e529f0&locale=en_US&flow_type=code&idp_flow_type=login"},{"id":54,"dateAddedLocal":"11/07/2018, 12:31:28","dateAddedUTC":"2018-07-11T07:01:28.355Z","index":3,"parentId":"18","title":"SAC"},{"id":55,"dateAddedLocal":"11/04/2018, 17:14:55","dateAddedUTC":"2018-04-11T11:44:55.948Z","index":0,"parentId":"54","title":"Measures and Dimensions | SAP Analytics Cloud | Resources|SAP","url":"https://www.sapanalytics.cloud/modeling-measures-dimensions/"},{"id":56,"dateAddedLocal":"11/04/2018, 17:15:12","dateAddedUTC":"2018-04-11T11:45:12.010Z","index":1,"parentId":"54","title":"5 Practical Tips for BusinessObjects Cloud Beginners | SAP Blogs","url":"https://blogs.sap.com/2016/08/09/5-practical-tips-for-businessobjects-cloud-beginners/"},{"id":57,"dateAddedLocal":"11/04/2018, 17:15:15","dateAddedUTC":"2018-04-11T11:45:15.511Z","index":2,"parentId":"54","title":"dimensions vs measures sap analytics cloud - Google Search","url":"https://www.google.co.in/search?q=dimensions+vs+measures+sap+analytics+cloud&oq=dimensions+vs+measures+sap+analytics+cloud&aqs=chrome..69i57.7786j0j7&sourceid=chrome&ie=UTF-8"},{"id":58,"dateAddedLocal":"11/04/2018, 17:15:18","dateAddedUTC":"2018-04-11T11:45:18.648Z","index":3,"parentId":"54","title":"SAP Analytics Cloud","url":"https://pi-vancouver.us2.sapanalytics.cloud/sap/fpa/ui/tenants/039/app.html#;view_id=modellerHome;tab=Models;autoCreate=true"},{"id":59,"dateAddedLocal":"11/04/2018, 17:15:21","dateAddedUTC":"2018-04-11T11:45:21.562Z","index":4,"parentId":"54","title":"Configuring OAuth 2.0 Authorization Code Grant Workflow","url":"https://help.sap.com/doc/14cac91febef464dbb1efce20e3f1613/release/en-US/23ec63397cb041f4a920515973c31003.html"},{"id":60,"dateAddedLocal":"11/04/2018, 17:15:24","dateAddedUTC":"2018-04-11T11:45:24.666Z","index":5,"parentId":"54","title":"Understanding Model Types in SAP Analytics Cloud | SAP Analytics Cloud | Resources|SAP","url":"https://www.sapanalytics.cloud/resources-model-types/"},{"id":61,"dateAddedLocal":"11/04/2018, 17:15:29","dateAddedUTC":"2018-04-11T11:45:29.093Z","index":6,"parentId":"54","title":"Building Your First Model","url":"https://help.sap.com/doc/00f68c2e08b941f081002fd3691d86a7/2018.6/en-US/bdd0c64fad8945999d0a705a4d6b1b19.html"},{"id":62,"dateAddedLocal":"11/04/2018, 17:15:58","dateAddedUTC":"2018-04-11T11:45:58.771Z","index":7,"parentId":"54","title":"Updating and Scheduling Models","url":"https://help.sap.com/doc/00f68c2e08b941f081002fd3691d86a7/release/en-US/6aa6a99d4eb5467896c4fd47bc9c7642.html"},{"id":63,"dateAddedLocal":"11/04/2018, 17:16:03","dateAddedUTC":"2018-04-11T11:46:03.460Z","index":8,"parentId":"54","title":"Creating Your First Story","url":"https://help.sap.com/doc/00f68c2e08b941f081002fd3691d86a7/release/en-US/fa31c0480f1f4c39af0692cd9a80f95b.html#loiofa31c0480f1f4c39af0692cd9a80f95b__p_createpage"},{"id":64,"dateAddedLocal":"11/04/2018, 17:16:06","dateAddedUTC":"2018-04-11T11:46:06.081Z","index":9,"parentId":"54","title":"Glossary","url":"https://help.sap.com/doc/00f68c2e08b941f081002fd3691d86a7/release/en-US/dab9f3e017cc4d30b2919d2cd1368bff.html?"},{"id":65,"dateAddedLocal":"24/04/2018, 12:16:06","dateAddedUTC":"2018-04-24T06:46:06.968Z","index":10,"parentId":"54","title":"SAC - Meeting notes - Google Docs","url":"https://docs.google.com/document/d/1uQF5oFEspP6kVUtAvqZE5hCeefMWIt2rBoXnFvRfFfU/edit#heading=h.8zil07pn5753"},{"id":66,"dateAddedLocal":"24/04/2018, 14:59:35","dateAddedUTC":"2018-04-24T09:29:35.833Z","index":11,"parentId":"54","title":"Spike: SAP Analytics Cloud - Snaps - Confluence","url":"https://mysnaplogic.atlassian.net/wiki/spaces/SNAP/pages/273678356/Spike+SAP+Analytics+Cloud"},{"id":67,"dateAddedLocal":"03/05/2018, 10:46:58","dateAddedUTC":"2018-05-03T05:16:58.102Z","index":12,"parentId":"54","title":"SAP-AnalyticsCloud-Research-Spike1_1.docx - Google Docs","url":"https://docs.google.com/document/d/14qRDZ_5Sycs-MHgLdzFIZuU5EHKynwtcyIj8oJCA7Zw/edit"},{"id":68,"dateAddedLocal":"04/05/2018, 22:42:05","dateAddedUTC":"2018-05-04T17:12:05.361Z","index":13,"parentId":"54","title":"pipelines_backup - Google Drive","url":"https://drive.google.com/drive/u/1/folders/1wWc4cqgrmNAGkLYRlyToY45XE3tJ3O6m"},{"id":19,"dateAddedLocal":"18/01/2018, 14:12:57","dateAddedUTC":"2018-01-18T08:42:57.778Z","index":14,"parentId":"1","title":"Microsoft Manual of Style, Fourth Edition","url":"https://ptgmedia.pearsoncmg.com/images/9780735648715/samplepages/9780735648715.pdf"},{"id":20,"dateAddedLocal":"16/02/2018, 16:47:18","dateAddedUTC":"2018-02-16T11:17:18.144Z","index":15,"parentId":"1","title":"[SWAT-1186] [DOC] Join Snap - 'Join paths' property description has been updated - JIRA","url":"https://mysnaplogic.atlassian.net/browse/SWAT-1186"},{"id":21,"dateAddedLocal":"11/07/2018, 12:31:28","dateAddedUTC":"2018-07-11T07:01:28.352Z","index":16,"parentId":"1","title":"SSH Auth"},{"id":41,"dateAddedLocal":"19/02/2018, 14:26:06","dateAddedUTC":"2018-02-19T08:56:06.088Z","index":0,"parentId":"21","title":"SSH Auth - Draft Product Docs - Confluence","url":"https://mysnaplogic.atlassian.net/wiki/spaces/SPD/pages/59652604/SSH+Auth"},{"id":42,"dateAddedLocal":"19/02/2018, 14:26:25","dateAddedUTC":"2018-02-19T08:56:25.297Z","index":1,"parentId":"21","title":"Creating SSH keys - Jorge Reyes - Confluence","url":"https://mysnaplogic.atlassian.net/wiki/spaces/~jreyes/pages/45711366/Creating+SSH+keys"},{"id":43,"dateAddedLocal":"19/02/2018, 14:26:30","dateAddedUTC":"2018-02-19T08:56:30.607Z","index":2,"parentId":"21","title":"MySQL Account - Draft Product Docs - Confluence","url":"https://mysnaplogic.atlassian.net/wiki/spaces/SPD/pages/60171887/MySQL+Account"},{"id":44,"dateAddedLocal":"19/02/2018, 14:27:06","dateAddedUTC":"2018-02-19T08:57:06.889Z","index":3,"parentId":"21","title":"File Writer - Draft Product Docs - Confluence","url":"https://mysnaplogic.atlassian.net/wiki/spaces/SPD/pages/60254283/File+Writer"},{"id":45,"dateAddedLocal":"19/02/2018, 14:27:17","dateAddedUTC":"2018-02-19T08:57:17.121Z","index":4,"parentId":"21","title":"Multi File Reader - Draft Product Docs - Confluence","url":"https://mysnaplogic.atlassian.net/wiki/spaces/SPD/pages/60254741/Multi+File+Reader"},{"id":46,"dateAddedLocal":"19/02/2018, 14:27:41","dateAddedUTC":"2018-02-19T08:57:41.220Z","index":5,"parentId":"21","title":"ZipFile Write - Draft Product Docs - Confluence","url":"https://mysnaplogic.atlassian.net/wiki/spaces/SPD/pages/60255034/ZipFile+Write"},{"id":47,"dateAddedLocal":"19/02/2018, 14:28:34","dateAddedUTC":"2018-02-19T08:58:34.283Z","index":6,"parentId":"21","title":"Directory Browser - Draft Product Docs - Confluence","url":"https://mysnaplogic.atlassian.net/wiki/spaces/SPD/pages/60253533/Directory+Browser"},{"id":48,"dateAddedLocal":"19/02/2018, 14:28:38","dateAddedUTC":"2018-02-19T08:58:38.707Z","index":7,"parentId":"21","title":"File Delete - Draft Product Docs - Confluence","url":"https://mysnaplogic.atlassian.net/wiki/spaces/SPD/pages/60253633/File+Delete"},{"id":49,"dateAddedLocal":"19/02/2018, 14:28:42","dateAddedUTC":"2018-02-19T08:58:42.275Z","index":8,"parentId":"21","title":"File Operation - Draft Product Docs - Confluence","url":"https://mysnaplogic.atlassian.net/wiki/spaces/SPD/pages/226328720/File+Operation"},{"id":50,"dateAddedLocal":"20/02/2018, 10:26:01","dateAddedUTC":"2018-02-20T04:56:01.774Z","index":9,"parentId":"21","title":"Using PuTTYgen on Windows to generate SSH key pairs | SSH.COM","url":"https://www.ssh.com/ssh/putty/windows/puttygen#sec-PuTTYgen-download-and-install"},{"id":22,"dateAddedLocal":"11/07/2018, 12:31:28","dateAddedUTC":"2018-07-11T07:01:28.352Z","index":17,"parentId":"1","title":"Unable to Update Fix Version"},{"id":37,"dateAddedLocal":"20/02/2018, 21:54:30","dateAddedUTC":"2018-02-20T16:24:30.904Z","index":0,"parentId":"22","title":"[SWAT-1199] [Docs] Snowflake: Driver related update for batch execution - JIRA","url":"https://mysnaplogic.atlassian.net/browse/SWAT-1199?filter=21644"},{"id":38,"dateAddedLocal":"20/02/2018, 21:55:29","dateAddedUTC":"2018-02-20T16:25:29.344Z","index":1,"parentId":"22","title":"[SWAT-1186] [DOC] Join Snap - 'Join paths' property description has been updated - JIRA","url":"https://mysnaplogic.atlassian.net/browse/SWAT-1186?filter=21644&jql=fixVersion%20in%20(EMPTY%2C%204.11%2C%204.12)%20AND%20assignee%20in%20(currentUser())%20ORDER%20BY%20status%20ASC"},{"id":39,"dateAddedLocal":"20/02/2018, 21:55:58","dateAddedUTC":"2018-02-20T16:25:58.312Z","index":2,"parentId":"22","title":"[SWAT-1160] [Docs] Update Ultra tasks doc - JIRA","url":"https://mysnaplogic.atlassian.net/browse/SWAT-1160?filter=21644"},{"id":40,"dateAddedLocal":"20/02/2018, 21:57:19","dateAddedUTC":"2018-02-20T16:27:19.736Z","index":3,"parentId":"22","title":"[SWAT-881] [DOC] Provide email account examples with gmail and office365 - JIRA","url":"https://mysnaplogic.atlassian.net/browse/SWAT-881?filter=21644"},{"id":23,"dateAddedLocal":"27/03/2018, 13:19:09","dateAddedUTC":"2018-03-27T07:49:09.534Z","index":18,"parentId":"1","title":"Ticket Sizing Sheet","url":"https://docs.google.com/spreadsheets/d/1AljJ9I6aeJJE3_FEu18ouDO-QIK-zohVt_pyMld9wFs/edit#gid=46590717"},{"id":24,"dateAddedLocal":"11/07/2018, 12:31:28","dateAddedUTC":"2018-07-11T07:01:28.352Z","index":19,"parentId":"1","title":"Tableau Snap Pack"},{"id":36,"dateAddedLocal":"13/04/2018, 10:36:18","dateAddedUTC":"2018-04-13T05:06:18.270Z","index":0,"parentId":"24","title":"Versions-Tableau Server REST API","url":"http://onlinehelp.tableau.com/current/api/rest_api/en-us/help.htm#REST/rest_api_concepts_versions.htm"},{"id":25,"dateAddedLocal":"11/07/2018, 12:31:28","dateAddedUTC":"2018-07-11T07:01:28.352Z","index":20,"parentId":"1","title":"OpenAPI"},{"id":32,"dateAddedLocal":"30/04/2018, 14:20:00","dateAddedUTC":"2018-04-30T08:50:00.856Z","index":0,"parentId":"25","title":"Data Types - Swagger","url":"https://swagger.io/docs/specification/data-models/data-types/#numbers"},{"id":33,"dateAddedLocal":"01/05/2018, 13:58:40","dateAddedUTC":"2018-05-01T08:28:40.084Z","index":1,"parentId":"25","title":"Basic Structure - Swagger","url":"https://swagger.io/docs/specification/basic-structure/"},{"id":34,"dateAddedLocal":"01/05/2018, 13:59:00","dateAddedUTC":"2018-05-01T08:29:00.410Z","index":2,"parentId":"25","title":"About Swagger Specification | Documentation | Swagger","url":"https://swagger.io/docs/specification/about/"},{"id":35,"dateAddedLocal":"01/05/2018, 13:59:10","dateAddedUTC":"2018-05-01T08:29:10.188Z","index":3,"parentId":"25","title":"Data Types - Swagger","url":"https://swagger.io/docs/specification/data-models/data-types/#file"},{"id":26,"dateAddedLocal":"24/05/2018, 18:29:11","dateAddedUTC":"2018-05-24T12:59:11.249Z","index":21,"parentId":"1","title":"Munshi Premchand's Stories मुंशी प्रेमचन्द की रचनाएँ: ईदगाह","url":"http://premchand.kahaani.org/2006/03/blog-post_114186257841658058.html"},{"id":27,"dateAddedLocal":"11/07/2018, 12:31:28","dateAddedUTC":"2018-07-11T07:01:28.352Z","index":22,"parentId":"1","title":"Doc Structure Template"},{"id":30,"dateAddedLocal":"31/05/2018, 11:15:59","dateAddedUTC":"2018-05-31T05:45:59.157Z","index":0,"parentId":"27","title":"Documentation Refresh v0.4.docx - Google Docs","url":"https://docs.google.com/document/d/1Mkgv31e00stppJCsUP1wMgc8hu7nu0sxcjvFCtVSE2w/edit"},{"id":31,"dateAddedLocal":"31/05/2018, 11:16:19","dateAddedUTC":"2018-05-31T05:46:19.750Z","index":1,"parentId":"27","title":"For doc revamp - Google Docs","url":"https://docs.google.com/document/d/1JZAYo8maZvdaPIfQdLgNsh1r-NTDpY50fsZsSpvd9uQ/edit"},{"id":28,"dateAddedLocal":"22/06/2018, 12:49:40","dateAddedUTC":"2018-06-22T07:19:40.787Z","index":23,"parentId":"1","title":"Date Epoch Example - Designing Pipelines - SnapLogic Community","url":"https://community.snaplogic.com/t/date-epoch-example/127"},{"id":29,"dateAddedLocal":"10/07/2018, 23:26:49","dateAddedUTC":"2018-07-10T17:56:49.838Z","index":24,"parentId":"1","title":"SnapLogic User Login","url":"https://canary.elastic.snaplogic.com/sl/login.html?v=a75d"},{"id":129,"dateAddedLocal":"17/07/2018, 09:38:25","dateAddedUTC":"2018-07-17T04:08:25.555Z","index":25,"parentId":"1","title":"20180710-GitHubCloudIntegration.mp4 | Powered by Box","url":"https://snaplogic.app.box.com/s/zbixr2bimo2s8fbmepha9sv8hksujjiq"},{"id":133,"dateAddedLocal":"31/07/2018, 14:04:50","dateAddedUTC":"2018-07-31T08:34:50.848Z","index":26,"parentId":"1","title":"Deprecated"},{"id":132,"dateAddedLocal":"31/07/2018, 14:04:21","dateAddedUTC":"2018-07-31T08:34:21.156Z","index":0,"parentId":"133","title":"Sliding+Time+Window - Emerging Products - Confluence","url":"https://mysnaplogic.atlassian.net/wiki/spaces/EmergingProducts/pages/170033171/Sliding+Time+Window"},{"id":134,"dateAddedLocal":"31/07/2018, 14:05:52","dateAddedUTC":"2018-07-31T08:35:52.592Z","index":1,"parentId":"133","title":"New folder"},{"id":135,"dateAddedLocal":"31/07/2018, 14:05:52","dateAddedUTC":"2018-07-31T08:35:52.592Z","index":0,"parentId":"134","title":"Search - Confluence","url":"https://mysnaplogic.atlassian.net/wiki/dosearchsite.action?queryString=Spark+mode+(Deprecated)&cql=siteSearch+~+%22Spark+mode+(Deprecated)%22&startIndex=30"},{"id":136,"dateAddedLocal":"31/07/2018, 14:05:52","dateAddedUTC":"2018-07-31T08:35:52.593Z","index":1,"parentId":"134","title":"Aggregate - Draft Product Docs - Confluence","url":"https://mysnaplogic.atlassian.net/wiki/spaces/SPD/pages/60817634/Aggregate"},{"id":137,"dateAddedLocal":"31/07/2018, 14:05:52","dateAddedUTC":"2018-07-31T08:35:52.594Z","index":2,"parentId":"134","title":"Streaming+Aggregate - Emerging Products - Confluence","url":"https://mysnaplogic.atlassian.net/wiki/spaces/EmergingProducts/pages/170065943/Streaming+Aggregate"},{"id":138,"dateAddedLocal":"31/07/2018, 14:05:52","dateAddedUTC":"2018-07-31T08:35:52.594Z","index":3,"parentId":"134","title":"MS Dynamics 365 Sales Update - Draft Product Docs - Confluence","url":"https://mysnaplogic.atlassian.net/wiki/spaces/SPD/pages/590512242/MS+Dynamics+365+Sales+Update"},{"id":139,"dateAddedLocal":"31/07/2018, 14:05:52","dateAddedUTC":"2018-07-31T08:35:52.595Z","index":4,"parentId":"134","title":"Alternator - Emerging Products - Confluence","url":"https://mysnaplogic.atlassian.net/wiki/spaces/EmergingProducts/pages/147849313/Alternator"},{"id":140,"dateAddedLocal":"31/07/2018, 14:05:52","dateAddedUTC":"2018-07-31T08:35:52.595Z","index":5,"parentId":"134","title":"Gate - Emerging Products - Confluence","url":"https://mysnaplogic.atlassian.net/wiki/spaces/EmergingProducts/pages/149258464/Gate"},{"id":141,"dateAddedLocal":"31/07/2018, 14:05:52","dateAddedUTC":"2018-07-31T08:35:52.596Z","index":6,"parentId":"134","title":"Spark Logs - Draft Product Docs - Confluence","url":"https://mysnaplogic.atlassian.net/wiki/spaces/SPD/pages/60888834/Spark+Logs"},{"id":142,"dateAddedLocal":"31/07/2018, 14:05:52","dateAddedUTC":"2018-07-31T08:35:52.596Z","index":7,"parentId":"134","title":"Confluence","url":"https://mysnaplogic.atlassian.net/wiki/spaces/SPD/pages/494043187/SAP+Analytics+Cloud+Delete"},{"id":143,"dateAddedLocal":"31/07/2018, 14:05:52","dateAddedUTC":"2018-07-31T08:35:52.597Z","index":8,"parentId":"134","title":"Sliding+Count+Window - Emerging Products - Confluence","url":"https://mysnaplogic.atlassian.net/wiki/spaces/EmergingProducts/pages/169082942/Sliding+Count+Window"},{"id":144,"dateAddedLocal":"31/07/2018, 14:05:52","dateAddedUTC":"2018-07-31T08:35:52.597Z","index":9,"parentId":"134","title":"Tumbling+Count+Window - Emerging Products - Confluence","url":"https://mysnaplogic.atlassian.net/wiki/spaces/EmergingProducts/pages/170197004/Tumbling+Count+Window"},{"id":145,"dateAddedLocal":"31/07/2018, 14:05:52","dateAddedUTC":"2018-07-31T08:35:52.598Z","index":10,"parentId":"134","title":"Tumbling+Time+Window - Emerging Products - Confluence","url":"https://mysnaplogic.atlassian.net/wiki/spaces/EmergingProducts/pages/170065926/Tumbling+Time+Window"},{"id":146,"dateAddedLocal":"31/07/2018, 14:05:52","dateAddedUTC":"2018-07-31T08:35:52.598Z","index":11,"parentId":"134","title":"Sliding+Time+Window - Emerging Products - Confluence","url":"https://mysnaplogic.atlassian.net/wiki/spaces/EmergingProducts/pages/170033171/Sliding+Time+Window"},{"id":147,"dateAddedLocal":"31/07/2018, 14:05:52","dateAddedUTC":"2018-07-31T08:35:52.599Z","index":12,"parentId":"134","title":"bookmark all tabs - Google Search","url":"https://www.google.co.in/search?q=bookmark+all+tabs&oq=bookmark+all+tabs&aqs=chrome..69i57j0l5.5036j1j7&sourceid=chrome&ie=UTF-8"},{"id":148,"dateAddedLocal":"31/07/2018, 14:11:00","dateAddedUTC":"2018-07-31T08:41:00.031Z","index":2,"parentId":"133","title":"Deprecated Live"},{"id":149,"dateAddedLocal":"31/07/2018, 14:11:00","dateAddedUTC":"2018-07-31T08:41:00.032Z","index":0,"parentId":"148","title":"New folder"},{"id":150,"dateAddedLocal":"31/07/2018, 14:11:00","dateAddedUTC":"2018-07-31T08:41:00.032Z","index":0,"parentId":"149","title":"Search - SnapLogic Documentation","url":"https://docs-snaplogic.atlassian.net/wiki/dosearchsite.action?queryString=Spark+mode+(Deprecated)&cql=siteSearch+~+%22Spark+mode+(Deprecated)%22&startIndex=20"},{"id":151,"dateAddedLocal":"31/07/2018, 14:11:00","dateAddedUTC":"2018-07-31T08:41:00.034Z","index":1,"parentId":"149","title":"Twofish Decrypt - SnapLogic Documentation - SnapLogic Documentation","url":"https://docs-snaplogic.atlassian.net/wiki/spaces/SD/pages/1439087/Twofish+Decrypt"},{"id":152,"dateAddedLocal":"31/07/2018, 14:11:00","dateAddedUTC":"2018-07-31T08:41:00.036Z","index":2,"parentId":"149","title":"Twofish Encrypt - SnapLogic Documentation - SnapLogic Documentation","url":"https://docs-snaplogic.atlassian.net/wiki/spaces/SD/pages/1439084/Twofish+Encrypt"},{"id":153,"dateAddedLocal":"31/07/2018, 14:11:00","dateAddedUTC":"2018-07-31T08:41:00.038Z","index":3,"parentId":"149","title":"JIRA Create - SnapLogic Documentation - SnapLogic Documentation","url":"https://docs-snaplogic.atlassian.net/wiki/spaces/SD/pages/1439254/JIRA+Create"},{"id":154,"dateAddedLocal":"31/07/2018, 14:11:00","dateAddedUTC":"2018-07-31T08:41:00.039Z","index":4,"parentId":"149","title":"Active Directory Add Member - SnapLogic Documentation - SnapLogic Documentation","url":"https://docs-snaplogic.atlassian.net/wiki/spaces/SD/pages/1437988/Active+Directory+Add+Member"},{"id":155,"dateAddedLocal":"31/07/2018, 14:11:00","dateAddedUTC":"2018-07-31T08:41:00.040Z","index":5,"parentId":"149","title":"Azure Active Directory Authenticate Users - SnapLogic Documentation - SnapLogic Documentation","url":"https://docs-snaplogic.atlassian.net/wiki/spaces/SD/pages/1438391/Azure+Active+Directory+Authenticate+Users"},{"id":156,"dateAddedLocal":"31/07/2018, 14:11:00","dateAddedUTC":"2018-07-31T08:41:00.041Z","index":6,"parentId":"149","title":"Azure Active Directory List Users - SnapLogic Documentation - SnapLogic Documentation","url":"https://docs-snaplogic.atlassian.net/wiki/spaces/SD/pages/1438384/Azure+Active+Directory+List+Users"},{"id":157,"dateAddedLocal":"31/07/2018, 14:11:00","dateAddedUTC":"2018-07-31T08:41:00.042Z","index":7,"parentId":"149","title":"Box Create User - SnapLogic Documentation - SnapLogic Documentation","url":"https://docs-snaplogic.atlassian.net/wiki/spaces/SD/pages/1439313/Box+Create+User"},{"id":158,"dateAddedLocal":"31/07/2018, 14:11:00","dateAddedUTC":"2018-07-31T08:41:00.043Z","index":8,"parentId":"149","title":"LDAP Delete Attribute - SnapLogic Documentation - SnapLogic Documentation","url":"https://docs-snaplogic.atlassian.net/wiki/spaces/SD/pages/1439306/LDAP+Delete+Attribute"},{"id":159,"dateAddedLocal":"31/07/2018, 14:11:00","dateAddedUTC":"2018-07-31T08:41:00.044Z","index":9,"parentId":"149","title":"OpenAir Write-Update - SnapLogic Documentation - SnapLogic Documentation","url":"https://docs-snaplogic.atlassian.net/wiki/spaces/SD/pages/1437914/OpenAir+Write-Update"},{"id":160,"dateAddedLocal":"31/07/2018, 14:11:00","dateAddedUTC":"2018-07-31T08:41:00.045Z","index":10,"parentId":"149","title":"Azure Active Directory Update Entry - SnapLogic Documentation - SnapLogic Documentation","url":"https://docs-snaplogic.atlassian.net/wiki/spaces/SD/pages/1438388/Azure+Active+Directory+Update+Entry"},{"id":161,"dateAddedLocal":"31/07/2018, 14:11:00","dateAddedUTC":"2018-07-31T08:41:00.046Z","index":11,"parentId":"149","title":"Azure Active Directory Create Entry - SnapLogic Documentation - SnapLogic Documentation","url":"https://docs-snaplogic.atlassian.net/wiki/spaces/SD/pages/1438348/Azure+Active+Directory+Create+Entry"},{"id":162,"dateAddedLocal":"31/07/2018, 14:11:00","dateAddedUTC":"2018-07-31T08:41:00.046Z","index":12,"parentId":"149","title":"LDAP Delete Attribute Value - SnapLogic Documentation - SnapLogic Documentation","url":"https://docs-snaplogic.atlassian.net/wiki/spaces/SD/pages/1439309/LDAP+Delete+Attribute+Value"},{"id":163,"dateAddedLocal":"31/07/2018, 14:11:00","dateAddedUTC":"2018-07-31T08:41:00.047Z","index":13,"parentId":"149","title":"Aggregate - SnapLogic Documentation - SnapLogic Documentation","url":"https://docs-snaplogic.atlassian.net/wiki/spaces/SD/pages/1438462/Aggregate"},{"id":164,"dateAddedLocal":"31/07/2018, 14:11:00","dateAddedUTC":"2018-07-31T08:41:00.048Z","index":14,"parentId":"149","title":"Expensify Export Report - SnapLogic Documentation - SnapLogic Documentation","url":"https://docs-snaplogic.atlassian.net/wiki/spaces/SD/pages/1439096/Expensify+Export+Report"},{"id":165,"dateAddedLocal":"31/07/2018, 14:11:00","dateAddedUTC":"2018-07-31T08:41:00.049Z","index":15,"parentId":"149","title":"Box Write - SnapLogic Documentation - SnapLogic Documentation","url":"https://docs-snaplogic.atlassian.net/wiki/spaces/SD/pages/1438148/Box+Write"},{"id":166,"dateAddedLocal":"31/07/2018, 14:11:00","dateAddedUTC":"2018-07-31T08:41:00.049Z","index":16,"parentId":"149","title":"PGP Decrypt - SnapLogic Documentation - SnapLogic Documentation","url":"https://docs-snaplogic.atlassian.net/wiki/spaces/SD/pages/1439218/PGP+Decrypt"},{"id":167,"dateAddedLocal":"31/07/2018, 14:11:00","dateAddedUTC":"2018-07-31T08:41:00.050Z","index":17,"parentId":"149","title":"Twitter Streaming Query - SnapLogic Documentation - SnapLogic Documentation","url":"https://docs-snaplogic.atlassian.net/wiki/spaces/SD/pages/1438989/Twitter+Streaming+Query"},{"id":168,"dateAddedLocal":"31/07/2018, 14:11:00","dateAddedUTC":"2018-07-31T08:41:00.051Z","index":18,"parentId":"149","title":"MongoDB - Insert - SnapLogic Documentation - SnapLogic Documentation","url":"https://docs-snaplogic.atlassian.net/wiki/spaces/SD/pages/1439111/MongoDB+-+Insert"},{"id":169,"dateAddedLocal":"31/07/2018, 14:11:00","dateAddedUTC":"2018-07-31T08:41:00.052Z","index":19,"parentId":"149","title":"Union - SnapLogic Documentation - SnapLogic Documentation","url":"https://docs-snaplogic.atlassian.net/wiki/spaces/SD/pages/1438544/Union"},{"id":170,"dateAddedLocal":"31/07/2018, 14:11:00","dateAddedUTC":"2018-07-31T08:41:00.053Z","index":20,"parentId":"149","title":"Sequence Parser - SnapLogic Documentation - SnapLogic Documentation","url":"https://docs-snaplogic.atlassian.net/wiki/spaces/SD/pages/1438758/Sequence+Parser"},{"id":171,"dateAddedLocal":"31/07/2018, 14:11:00","dateAddedUTC":"2018-07-31T08:41:00.054Z","index":21,"parentId":"149","title":"RC File Formatter - SnapLogic Documentation - SnapLogic Documentation","url":"https://docs-snaplogic.atlassian.net/wiki/spaces/SD/pages/1438143/RC+File+Formatter"},{"id":172,"dateAddedLocal":"31/07/2018, 14:11:00","dateAddedUTC":"2018-07-31T08:41:00.054Z","index":22,"parentId":"149","title":"RC File Parser - SnapLogic Documentation - SnapLogic Documentation","url":"https://docs-snaplogic.atlassian.net/wiki/spaces/SD/pages/1438144/RC+File+Parser"},{"id":173,"dateAddedLocal":"31/07/2018, 14:11:00","dateAddedUTC":"2018-07-31T08:41:00.055Z","index":23,"parentId":"149","title":"PostgreSQL - Delete - SnapLogic Documentation - SnapLogic Documentation","url":"https://docs-snaplogic.atlassian.net/wiki/spaces/SD/pages/1438845/PostgreSQL+-+Delete"},{"id":174,"dateAddedLocal":"31/07/2018, 14:11:00","dateAddedUTC":"2018-07-31T08:41:00.056Z","index":24,"parentId":"149","title":"ForEach - SnapLogic Documentation - SnapLogic Documentation","url":"https://docs-snaplogic.atlassian.net/wiki/spaces/SD/pages/1438732/ForEach"},{"id":175,"dateAddedLocal":"31/07/2018, 14:11:00","dateAddedUTC":"2018-07-31T08:41:00.056Z","index":25,"parentId":"149","title":"Eloqua Delete - SnapLogic Documentation - SnapLogic Documentation","url":"https://docs-snaplogic.atlassian.net/wiki/spaces/SD/pages/1438917/Eloqua+Delete"},{"id":176,"dateAddedLocal":"31/07/2018, 14:11:00","dateAddedUTC":"2018-07-31T08:41:00.057Z","index":26,"parentId":"149","title":"Snowflake - Insert - SnapLogic Documentation - SnapLogic Documentation","url":"https://docs-snaplogic.atlassian.net/wiki/spaces/SD/pages/1438753/Snowflake+-+Insert"},{"id":177,"dateAddedLocal":"31/07/2018, 14:11:00","dateAddedUTC":"2018-07-31T08:41:00.058Z","index":27,"parentId":"149","title":"DynamoDB Bulk Get - SnapLogic Documentation - SnapLogic Documentation","url":"https://docs-snaplogic.atlassian.net/wiki/spaces/SD/pages/1438305/DynamoDB+Bulk+Get"}]